{"bundle_ref":{"digest":"sha256:a889f5d8e3313b4f83bb2c925f265019ed1edf48f3bf8c909b95da4318956ddb"},"checkpoint_id":"s1-source-closure-cp-2026-09-05","clear_before_start":true,"closure_revision":19,"epoch_id":"S1-E-finalizer","group_id":"bootstrap-and-shared-closure","run_id":"s1-source-close-2026-09-05","schema":"checkpoint/v1","state_ref":{"revision":19,"run_id":"s1-source-close-2026-09-05","state_revision":19},"state_revision":19,"workflow_version":"workflow/v1"}
