{"bundle_ref":{"digest":"sha256:0d2e2b0d9ddccf0779769e3208622a8e7aae51e73fd2b392c35b5a75e1932bf3"},"checkpoint_id":"s0-source-closure-cp-2026-09-04","clear_before_start":true,"closure_revision":1,"epoch_id":"S0-E1","group_id":"contracts-and-schema","run_id":"s0-source-transition-2026-09-04","schema":"checkpoint/v1","state_ref":{"revision":1,"run_id":"s0-source-transition-2026-09-04","state_revision":1},"state_revision":1,"workflow_version":"workflow/v1"}
